{
  "run_id": "run_20260403_112300_workflow_run_execution_refresh_wrapper_v1",
  "task_id": "task_20260403_112300_workflow_run_execution_refresh_wrapper_v1",
  "started_at": "2026-04-03T11:23:00Z",
  "ended_at": "2026-04-03T11:23:01Z",
  "status": "failed",
  "executor": "automation_wrapper",
  "steps": [
    {
      "step_index": 1,
      "timestamp": "2026-04-03T11:23:00Z",
      "action": "create_run_scaffold",
      "result": "ok",
      "note": "Execution refresh wrapper run scaffold created."
    },
    {
      "step_index": 2,
      "timestamp": "2026-04-03T11:23:00Z",
      "action": "load_runbook",
      "result": "ok",
      "note": "Loaded runbook: C:\\Users\\benda\\Desktop\\market_regime_v1\\automation\\config\\execution_refresh_runbook.json"
    },
    {
      "step_index": 3,
      "timestamp": "2026-04-03T11:23:00Z",
      "action": "run_stage:source_contract",
      "result": "failed",
      "note": "stage=source_contract | returncode=2 | stderr=python: can't open file 'C:\\\\Users\\\\benda\\\\Desktop\\\\market_regime_v1\\\\scripts\\\\execution_source_contract.py': [Errno 2] No such file or directory"
    },
    {
      "step_index": 4,
      "timestamp": "2026-04-03T11:23:00Z",
      "action": "validate_execution_chain",
      "result": "ok",
      "note": "chain_status=healthy"
    },
    {
      "step_index": 5,
      "timestamp": "2026-04-03T11:23:01Z",
      "action": "finalize_run",
      "result": "ok",
      "note": "Run finalized with status=failed"
    }
  ],
  "artifacts": {
    "report_paths": [
      "C:\\Users\\benda\\Desktop\\market_regime_v1\\automation\\reports\\run_20260403_112300_workflow_run_execution_refresh_wrapper_v1\\report_20260403_112300_workflow_run_execution_refresh_wrapper_v1.report.json"
    ],
    "screenshot_manifest_paths": [
      "C:\\Users\\benda\\Desktop\\market_regime_v1\\automation\\screenshots\\run_20260403_112300_workflow_run_execution_refresh_wrapper_v1\\manifest_20260403_112300_workflow_run_execution_refresh_wrapper_v1.screenshot_manifest.json"
    ],
    "pending_truth_patch_paths": []
  },
  "errors": [
    "stage=source_contract | returncode=2 | stderr=python: can't open file 'C:\\\\Users\\\\benda\\\\Desktop\\\\market_regime_v1\\\\scripts\\\\execution_source_contract.py': [Errno 2] No such file or directory"
  ],
  "warnings": []
}
